message_content,prelabel,label,cleaned_text,has_caps,has_phone,is_kiswahili_sheng
[#]\\u200b\\u200b\nYou are trying to log in to your KCB Mobile Banking profile. KCB WILL NOT CALL TO ASK FOR THIS CODE. TO KEEP YOUR ACCOUNT SECURE DO NOT SHARE THIS CODE WITH ANYONE. Please use Activation code: 8615. This code is valid for only 60s.\nO0P7B86VzMJ\n\nNEVER give anyone your banking PIN or code.,2: High-risk scam,scam,try log kcb mobile banking profile kcb ask code account secure share code use activation code code valid banking pin code,True,False,False
"Bwana, nifunike kwa ngao yako. Nilinde na maadui wangu, wale wanaoonekana na wasioonekana. Nijaze na nguvu na ujasiri kukabiliana na changamoto zozote. Amina. Jibu na 0 ili Kueneza ujumbe huu kwa wengine. Bonyeza *875*349 kupata sisi ni wale tuliobarikiwa kama skiza. Ili usipokee tena jumbe hizi, jibu STOP.",0: Legit (Low-risk),legit,ngao yako nilinde maadui wangu wale wanaoonekana wasioonekana nijaze nguvu ujasiri kukabiliana changamoto zozote ili kueneza ujumbe huu kwa wengine bonyeza kupata sisi wale tuliobarikiwa kama,True,False,True
"Mungu mpendwa, naomba ulinde watoto wangu. Waongoze kwenye njia iliyo sawa na walinde kutokana na hatari. Wajaze hekima na ujasiri. Familia yetu iwe kimbilio la upendo na amani. Amina. Jibu na 2 ili kueneza ujumbe huu kwa wengine. Bonyeza*875*353# kupata niponye Mungu kama skiza. Ili usipokee tena jumbe hizi, jibu STOP.",0: Legit (Low-risk),legit,ulinde watoto wangu waongoze iliyo sawa walinde kutokana hatari wajaze hekima ujasiri familia yetu iwe kimbilio upendo ili kueneza ujumbe huu kwa wengine bonyeza kupata niponye mungu kama,True,False,True
God knows you are tired,2: High-risk scam,scam,god know tired,True,False,False
"We will all return to GOD when we die but let's all strive to return to GOD while we still alive.ðŸ™Reply with 12 to subscribe. Dial *812*211# to get New Year. To stop receiving this message, reply Stop.",0: Legit (Low-risk),legit,return god die let strive return god alive reply subscribe dial new year stop receive message reply stop,True,False,False
"Hello, One of your credit acc is past 5 yrs retention period from last payment date and has been deleted from CRB database. SMS CR to 21272 to get CRB report. STOP*456*9*5#",0: Legit (Low-risk),legit,hello credit acc past yrs retention period payment date delete crb database sm crb report stop,True,False,False
"Congratulations! Win upto 2000x your stake, 100% FREEBET on first deposit, 30% Referral bonus and 30% cashback. Join https://bebacrash.com/ STOP *456*9*5#",2: High-risk scam,scam,congratulation win upto stake freebet deposit referral bonus cashback join stop,True,False,False
"Reminder!\n\nDear tenant,\nI wish to notify you of the changes made on your rent payment mode. Starting 1st, March 2025. All rent payments must be paid on time through our new secure Mpesa Till No: 4963212\n\nNo cash payment is acceptable onwards. Thank you \n\nRegards,\nLandlord.",0: Legit (Low-risk),legit,reminder dear tenant wish notify change rent payment mode start march rent payment pay time new secure mpesa till cash payment acceptable onwards thank regard landlord,True,False,False
"Hey ni Chacha ,ebu nitext WhatsApp saisai Kwa hii Number, Kuna Form ,Kuja before hiyo offer iishe",2: High-risk scam,scam,hey chacha ebu nitext whatsapp saisai kwa hii number kuna form kuja hiyo offer iishe,True,False,True
"Received Ksh 2000 top-up Tuesday bonus from METABET\nNew balance: Ksh 2000\nUse promo code 2000"" to REDEEM\nT$C APPLY\nwww.metabet.ke       STOP *456*9*5#""",2: High-risk scam,scam,receive ksh tuesday bonus metabet new balance ksh use promo code redeem apply stop,True,False,False
"Dear, there is a job waiting for you to accept, the salary is high, please contact us: wa.me/447575255035",0: Legit (Low-risk),legit,dear job wait accept salary high contact,False,False,False
"Dear tenant, rent payment is now via MPESA till4984814(FLEXPAY)due to problems with our regular rent account. PAY ON TIME. No other payment accepted. Management",2: High-risk scam,scam,dear tenant rent payment mpesa flexpay problem regular rent account pay time payment accept management,True,False,False
"Samahani! Huo ujumbe sio wako nimekosea nambari. Unazo siri zangu za biashara, ufute nitashukuru. Niandikie majina na nabali utakayopokea soda 0782598219 ",0: Legit (Low-risk),legit,samahani sio wako unazo siri zangu biashara ufute majina soda,True,False,True
"Hurry, KES 5,000 prizes await! Complete a transaction of KES 250+ on Branch today when  you use Paybill, Buy Goods, or bill payments on your app. #KrisiIbambe",2: High-risk scam,scam,hurry kes prize await complete transaction kes branch today use paybill buy good bill payment app krisiibambe,True,False,False
"You have received Ksh 8,000 from FALMEBET.\n\nBalance: KES 8,700.\n\nCheza Aviator Hapa\n\nbetfalme.ke",2: High-risk scam,scam,receive ksh falmebet balance kes cheza aviator hapa betfalme,True,False,False
"Dear  Customer;\nTALA   LOAN is now available to all M-PESA USERS,From:\n20,000\n50,000\n100,000\n250,000\nPayment;10 to 20 Months.To apply \nCall-0778832194",2: High-risk scam,scam,dear customer tala loan available pesa user payment month apply,True,False,False
"Mchungaji nakuomba unisaidie na100 niko na 20 ninunulie watoto unga kutoka jana hawajakula mtu wa duka amekataa kunipa unga ju ya deni,nitakuja kukulimia nilipe",0: Legit (Low-risk),legit,unisaidie ninunulie watoto unga kutoka mtu duka amekataa kunipa nitakuja kukulimia nilipe,True,False,True
God knows you are tired. He knows you are trying. Put him first,2: High-risk scam,scam,god know tired know try,True,False,False
lllll,0: Legit (Low-risk),legit,lllll,False,False,False
"GOOD NEWS!\nMPESA REF: QK10TC7QCY TIKETI YAKO IMEKUWA APPROVED \nImebakia 15MINS UITIWE Ksh40,000\n\nCONFIRM KWA KUBONYEZA *795#",0: Legit (Low-risk),legit,good news mpesa ref imekuwa approve imebakia uitiwe confirm kwa kubonyeza,True,False,False
"Wow Wow!! PSV Eindhoven vs Arsenal!!\nGET GET GET! 50X BONUS is being distributed, upto 2500 KES for everyone!\nClaim Now: www.kessbet.com STOP *456*9*5#",2: High-risk scam,scam,wow wow psv eindhoven arsenal bonus distribute upto kes claim stop,True,False,False
"NI TIME YAKO YA KUCHACHISHA CHEPKORIR\n\nNYAKUA KES. 128,900 SAA HII\n\nPLAY> pepea.ke\n\nDEPOSIT 99/- OR MORE UPATE HII PESA LEO",2: High-risk scam,scam,chepkorir saa hii play upate hii pesa,True,False,False
HAPPY COUNTRY!!\n\nYou have received KES 100 bonus for your first bet!\nRegister and activate your promo code Qbet.\n\nClaim Now: www.qbet.ke\n STOP *456*9*5#,2: High-risk scam,scam,happy country receive kes bonus bet register activate promo code qbet claim stop,True,False,False
'The only way to do great work is to love what you do.ðŸ™ŒðŸ™ŒTo spread this message reply with1.To stop receiving this message reply witth STOP.,0: Legit (Low-risk),legit,way great work love spread message reply stop receive message reply witth stop,False,False,False
"You can get sorted instantly by downloading this loan app on google playstore!!!!\n\nApproval in 5 minutes!!\n<3000-20,000>\n\n>>>ZURICASH\nhttps://bit.ly/3EoWSZd\n\nNO REGISTRATION FEE!",2: High-risk scam,scam,sort instantly download loan app google playstore approval minute zuricash registration fee,True,False,False
You get a 10% DISCOUNT on a new loan! Promocode: M49K valid 3 days Go to > https://hi.lendplus.ke/sdf14,2: High-risk scam,scam,discount new loan promocode valid day,True,False,False
You're so close to earning with the Uber App. Open the Uber app today to upload outstanding documents and finish activating your account. t.uber.com/u_doc Reply STOP 2 to +1 415-237-0403 to unsubscribe.,2: High-risk scam,scam,close earn uber app open uber app today upload outstanding document finish activate account reply stop unsubscribe,True,False,False
"No charges! Top up Airtime instantly via MPesa Paybill 760 000. Enter your Airtel, Safaricom or Telkom number as the account number.\nSTOP TO 20777",2: High-risk scam,scam,charge airtime instantly mpesa paybill enter airtel safaricom telkom number account number stop,True,False,False
"Dear Tenant,rent payment is now via MPESA TILL 4573124(TRADE SYSTEMS)due to problems with our regular method of payment.No other payment accepted.\nBy management",2: High-risk scam,scam,dear tenant rent payment mpesa till trade system problem regular method payment payment accept management,True,False,False
Received Ksh 500 topup WEDNESDAY bonus from SIMBABET\nNew balance: Ksh 500\nUse promo code 'Weno' to REDEEM\nT$C APPLY\nhttps://www.simbabet.ke STOP *456*9*5#,2: High-risk scam,scam,receive ksh topup wednesday bonus simbabet new balance ksh use promo code weno redeem apply stop,True,False,False
"Dear friends, U are selected for the W0rk from Home j0b offer. receive your daily salary 9000. Please contact wa.me/254776981548",1: Moderate-risk scam,scam,dear friend select home receive daily salary contact,True,False,False
"TCE1XRRWC3 Confirmed. You have received Ksh3,870.00 from JOEL KAZUNGU on 14/3/25. New MPESA balance is Ksh(LOCKED).Dial *35*0000*16# To Unlock.",2: High-risk scam,scam,confirm receive joel kazungu new mpesa balance ksh lock dial unlock,True,False,False
"QSOKO App Feedback\n\nDear Valued Customer,\n\nTell us about your experience with the QSOKO app! \nPlease complete our quick survey to help us improve.\n\nLink to survey https://shorturl.at/rSdjY\nThank you for your feedback! STOP *456*9*5#",2: High-risk scam,scam,qsoko app feedback dear value customer tell experience qsoko app complete quick survey help improve link survey thank feedback stop,True,False,False
TIMIZA NDOTO NA LUCKY 777! \n\nPlay Lucky 777! and enjoy return upto 95%.\n\nTest your luck with 50bob and above here\nhttp://gamepawa.com/\nSTOP*456*9*5#,2: High-risk scam,scam,lucky play lucky enjoy return upto test luck stop,True,False,False
"Maliza week strong, BONUS UNAYO!\n\nPEPEA pale SportPesa AVIATOR CHEZA Mr First, Kuna 4 Jackpots & Bonuses!\n\nhttps://spp.ke/CasinoB\n\nSTOP *456*9*5#",2: High-risk scam,scam,maliza week strong bonus unayo pepea pale sportpesa aviator cheza kuna jackpot bonus stop,True,False,False
"Amazing 3 Promos For You!\n-50X BONUS upto 2500 KES\n-100,000 KES CASH Giveaway\n-100% REFUND\n\nPSG vs Manchester City!\nwww.kessbet.com STOP *456*9*5#",2: High-risk scam,scam,amazing promos bonus upto ke ke cash giveaway refund psg manchester city stop,True,False,False
"Dear Customer,  Reply with1 to set Kenya National Anthem Instrumental by Kenya National Anthem Instrumental as your Skiza Tune.   Reply with2 to set KUMALO by JOHN as your Skiza Tune.  Relive historic moments with Skiza. Dial *811*4#  to set Today In History tunes.",2: High-risk scam,scam,dear customer reply set kenya national anthem instrumental kenya national anthem instrumental tune reply set kumalo tune relive historic moment dial set today history tune,True,False,False
"NOTICE! Dear tenant.  We are writing to let you know about a significant modification to our rent payment procedure. Effective from this SEPTEMBER  all rent payments will be done through:  LIPA NA MPESA  PAY BILL  Business number :4140343 Account Number ( your name or house number) NAME:APARTMENT SERVICES AGENCY  Cash or any other mode of payment will not be accepted deadline 7th SEPTEMBER.  Regards, Management.\n",2: High-risk scam,scam,notice dear tenant write let know significant modification rent payment procedure effective september rent payment lipa mpesa pay bill business number account number house number apartment service agency cash mode payment accept deadline september regard management,True,False,False
"Dear, You have been approved to get temporary j0b opportunities at home. The daily salary is 50,000, please click to contact: /wa.me/254726233508",2: High-risk scam,scam,dear approve temporary opportunity home daily salary click contact,True,False,False
"Hello Madam NAUMI, I hv sent 9.8M \nvia W/UNION for Clearance at MSA Port \nK.P.A pin:0541 \nP/wordQ25G315 Secret Word(AUE) Dr. YUSSUF MAJI Tz.0107755739\nSamahani! Huo ujumbe sio wako nimekosea nambari. Unazo siri zangu za biashara",2: High-risk scam,scam,hello madam send union clearance msa port pin secret word aue maji samahani sio wako unazo siri zangu biashara,True,False,False
"Hello, One of your credit acc is past 5 yrs retention period from last payment date and has been deleted from CRB database. SMS CR to 21272 to get CRB report. STOP*456*9*5#",0: Legit (Low-risk),legit,hello credit acc past yrs retention period payment date delete crb database sm crb report stop,True,False,False
"Dear Customer,  Reply with1 to set NI MUNGU by JOHN M as your Skiza Tune.   Reply with2 to set mimi by shiriyow ltd  as your Skiza Tune.  Relive historic moments with Skiza. Dial *811*4#  to set Today In History tunes.",2: High-risk scam,scam,dear customer reply set mungu tune reply set shiriyow ltd tune relive historic moment dial set today history tune,True,False,False
"Hey, do you have problem with missing marks, incomplete marks or want to upgrade results in your transcript?\n",0: Legit (Low-risk),legit,hey problem miss mark incomplete mark want upgrade result transcript,False,False,False
"CONGRATULATIONS TAO5D8LTFT confirmed You have received Ksh35,477.00 FROM WEKELEA B2C \n\nRegister> wekelea.com\n\nDEPOSIT,PLAY&WITHDRAW",2: High-risk scam,scam,congratulation confirm receive wekelea register deposit play withdraw,True,False,False
BREAKING NEWS - www.juubet.com is officially the fastest growing site in Kenya. Juubet now and get the highest payout in Africa STOP *456*9*5#,2: High-risk scam,scam,break news officially fast grow site kenya juubet high payout africa stop,True,False,False
"Congrats claim kes 50 free rain  enjoy happy hour,100% freebet on your 1st deposit,10%  final round bonus. \n\n link: https://www.aviatorpesa.ke/ STOP *456*9*5#",2: High-risk scam,scam,congrat claim kes free rain enjoy happy hour freebet deposit final round bonus link stop,True,False,False
"Dear Tenant,rent payment is now via MPESA Till 4826480 (PAY EASE)due to issues with our regular payment method.PAY ON TIME.No other payment accepted.Management.",2: High-risk scam,scam,dear tenant rent payment mpesa till pay ease issue regular payment method pay time payment accept management,True,False,False
HelloðŸ‘‹ðŸ» might you know someone who is looking for a job either part or full time? Needed this week,2: High-risk scam,scam,hello know look job time need week,True,False,False
"Guard your heart above all else, for it determines the course of your lifeðŸ™Reply with 99 to inspire your callers. To stop reply stop",0: Legit (Low-risk),legit,guard heart determine course life reply inspire caller stop reply stop,True,False,False
"Dear Customer, Reply with  1 to set tee rabi kucasisi by sheikh hassah ibrahim as your Skiza Tune.  Reply with  2 to set UPENDO by K45 as your Skiza Tune.  Relive historic moments with Skiza, dial *811*4# to set Today In History tunes. To stop receiving these messages reply with STOP",2: High-risk scam,scam,dear customer reply set tee rabi kucasisi sheikh hassah ibrahim tune reply set upendo tune relive historic moment dial set today history tune stop receive message reply stop,True,False,False
"LuckyBox ndio plug yako ya chapaa! \n\nChagua box yako upate 30k, 70 au 120k.\nSMS Box yako to 29302 USHINDE\nSASA! \nBox 1\nBox 2\nBox 3\nBox 4\nBox 5\nBoxA 6\nStop *456*9*5#\n",1: Moderate-risk scam,scam,ndio plug yako chapaa chagua box yako upate sms box yako ushinde sasa box box box box box boxa stop,True,False,True
"Hi,you can get  a new loan,Top up,buy off loan and refinance of 5k to 1 .5  million from JAFARI CREDIT direct to your mpesa within 3hrs ,no crb check up ,with just your current payslip,no paper work,commit as low as 500 in your payslip to get a loan,we also give to KFS 2023 call or sms victoriah0114127018",0: Legit (Low-risk),legit,new loan buy loan refinance million jafari credit direct mpesa crb check current payslip paper work commit low payslip loan kfs sm,True,False,False
NI WEWE TU UNALIA MSOTO!!.. WATU WANATAJIRIKA NA JET-X!\n\nCHEZA JET-X USHINDE UNONO!\n\nWIN UPTO 2 MILLION PALE JET-X TOURNAMENT\n\nhttps://odibets.com\nSTOP*456*9*5#,2: High-risk scam,scam,wewe unalia msoto watu wanatajirika jet cheza jet ushinde unono win upto million pale jet tournament stop,True,False,False
Lucky Lucky!! Everyday Lucky!!\nYou've got a Free 1000 KES Cash Bag!\nSuper Easy To Withdraw!!\n\nNottingham Forest vs Arsena\nwww.kessbet.com STOP *456*9*5#,2: High-risk scam,scam,lucky lucky everyday lucky get free kes cash bag super easy withdraw nottingham forest arsena stop,True,False,False
Telegram code: 92067\n\nYou can also tap on this link to log in:\nhttps://t.me/login/92067,2: High-risk scam,scam,tap link log,True,False,False
You could make Ksh 268 an hour on the road in Nairobi. Finish your account sign-up to start making money.* t.uber.com/lJ8929 Reply STOP 2 to +1 415-237-0403 to unsubscribe,2: High-risk scam,scam,ksh hour road nairobi finish account sign start make money reply stop unsubscribe,True,False,False
"Hello Grace,i've sent 4.8M via W\\Union to clear the containers at the port of Mombasa.M.T.C.N code ZTQGH1K6(KT) thank you.Dr.Alex TZ",0: Legit (Low-risk),legit,hello grace send clear container port mombasa code thank,True,False,False
"NOTICE!\n\nDear tenant.\nWe are writing to let you know about a significant modification to our year 2025 rent payment procedure.\nEffective from (MARCH) all rent payments will be done through:\n\nLIPA NA MPESA\nPAYBILL: 4576562\nACCOUNT: Your name or House Number\nNAME: APARTMENT SERVICES 3\n\nCash or any other mode of payment will not be accepted moving forward.\nDeadline 5th MARCH 2025.\n\nRegards,\nManagement",2: High-risk scam,scam,notice dear tenant write let know significant modification year rent payment procedure effective march rent payment lipa mpesa paybill account house number apartment service cash mode payment accept move forward deadline march regard management,True,False,False
"Look to the Lord and his strength; seek his face always, 1 Chronicles 16:11, Reply with 44 to spread this message of Encouragement. To entertain your callers with In you",0: Legit (Low-risk),legit,look lord strength seek face chronicle reply spread message encouragement entertain caller,True,False,False
"TALA LOANS now available as from:\n10,000/=\n20,000/=\n50,000/=\n100,000/=\n250,000/=\n 25% savings required call or sms the wordloan""\n0100656605""",2: High-risk scam,scam,tala loan available saving require sm wordloan,True,False,False
"Hello Grace,i've sent 4.8M via W\\Union to clear the containers at the port of Mombasa.M.T.C.N code ZTQGH1K6(KT) thank you.Dr.Alex TZ",0: Legit (Low-risk),legit,hello grace send clear container port mombasa code thank,True,False,False
"Hello. I'm manager. You are selected for a part-time job. You can work at home and get 3,6OO a day. More info: wa.me/6285643815349   STOP*456*9*5#",1: Moderate-risk scam,scam,hello manager select time job work home day info stop,True,False,False
MORE WAYS TO MAKE BIG MONEY! \n\nPlay our new game SUPER WHEEL and make more cash! \n\nRefer your friend and double your income. \n\n\nhttps://gamepawa.com\nStop*456*9*5#,2: High-risk scam,scam,way big money play new game super wheel cash refer friend double income stop,True,False,False
"Dear Parent/Guardian;\n Your child did not report to school with all the requirements stipulated in the newsletter. Also complete 75% of the school fees, failure to which will be sent home tomorrow to collect the same as the others begin their opening exams. Contact the school's accounts office via 0762307109 for inquiries. All payments should be made through our school's Paybill Account below;\nPlaybill: 714777\n Account: 420200367512\nRegards: School Management",2: High-risk scam,scam,dear parent guardian child report school requirement stipulate newsletter complete school fee failure send home tomorrow collect begin opening exam contact school account office inquiry payment school paybill account playbill account regard school management,True,False,False
You have 10 Shine Kenya Shinda Mamili entries.  Dial *444# or *544# & spend 20bob or send 200bob or more on M-Pesa for a chance to win 1M weekly.,1: Moderate-risk scam,scam,shine kenya shinda mamili entry dial spend send pesa chance win weekly,True,False,False
"Feeling the end-month pinch ?We ve got you covered with SC Juza Mobile loan App, you can borrow from KES 1,000 to KES 100,000k, at only 1.6% interest rate p.m. and enjoy flexibility of up to 60 days to repay your loan. T STOP*456*9*5#",2: High-risk scam,scam,feel end month pinch get cover juza mobile loan app borrow kes kes interest rate enjoy flexibility day repay loan stop,True,False,False
"Hello, you have been selected for a part-time/full-time opportunity. 2000-5000days. Accept this vacancy  http://wa.me/254110426104",2: High-risk scam,scam,hello select time time opportunity accept vacancy,True,False,False
Received Ksh 500 topup WEDNESDAY bonus from SIMBABET\nNew balance: Ksh 500\nUse promo code 'Weno' to REDEEM\nT$C APPLY\nhttps://www.simbabet.ke STOP *456*9*5#,2: High-risk scam,scam,receive ksh topup wednesday bonus simbabet new balance ksh use promo code weno redeem apply stop,True,False,False
"Confirmed! Ksh4,500 received from PATAPESA.\nYour balance is Ksh4,500. Use promo code 'patapesa' to redeem.\nhttps://patapesa.ke/promotions STOP *456*9*5#",2: High-risk scam,scam,confirm receive patapesa balance use promo code patapesa redeem stop,True,False,False
"Captain! BONUS UNAYO na Pia kuna 7 milli worth of FREE BETS pale SportPesa Aviator!\n\nMake It Count, grab share yako NOW!\n\nhttps://spp.ke/AVIATORB\n\nSTOP*456*9*5#",2: High-risk scam,scam,captain bonus unayo pia kuna milli worth free bet pale sportpesa aviator count grab share yako stop,True,False,False
Dont worry,0: Legit (Low-risk),legit,worry,True,False,False
"Wow Wow!! Arsenal vs Ipswich Town!\nGET GET GET! 50X BONUS is being distributed, upto 2500 KES for everyone!\nClaim Now: www.kessbet.com STOP *456*9*5#",2: High-risk scam,scam,wow wow arsenal ipswich town bonus distribute upto kes claim stop,True,False,False
"GOOD NEWS!\nMPESA REF: QK10TC7QCY TIKETI YAKO IMEKUWA APPROVED \nImebakia 15MINS UITIWE Ksh40,000\n\nCONFIRM KWA KUBONYEZA *795#",0: Legit (Low-risk),legit,good news mpesa ref imekuwa approve imebakia uitiwe confirm kwa kubonyeza,True,False,False
"''When the replacement from God arrives, you'll forget what you lost''ðŸ’“Dear Customer, Reply with 99 to set *812*358# Gobta Dhiiga Loo Shuboo as your skiza. To stop receiving this message reply with,Stop",0: Legit (Low-risk),legit,replacement god arrive forget lose dear customer reply set gobta dhiiga loo shuboo skiza stop receive message reply stop,True,False,False
"Give thanks to the Lord, for he is good. His love endures forever, Psalm 136:1. Reply with 44 to spread this message of Encouragement. To entertain your callers with Seek the Lord and his strength"" dial *811*353#""",0: Legit (Low-risk),legit,thank lord good love endure forever psalm reply spread message encouragement entertain caller seek lord strength dial,True,False,False
"CONGRATULATIONS TCB5D8LTFT confirmed You have received Ksh305,477 FROM WEKELEA  BONUS A/C \n\nRegister> wekelea.com \n\n\nDEPOSIT99&PLAY",2: High-risk scam,scam,congratulation confirm receive wekelea bonus register play,True,False,False
2025,0: Legit (Low-risk),legit,empty,False,False,False
Easily use your phone. Earn 800-7000KES per day only for those over 24 years old. Use wa to start work:\nhttps://wa.me/491630324237\nSTOP*456*9*5#,2: High-risk scam,scam,easily use phone earn day year old use start work stop,True,False,False
"KCB   M-PESA LOANS is now available to all M-PESA users 10% interest from\n5,000/=\n10,000/=\n20,000/=\n50,000/=\n100,000/=\nTo apply send 555555 to 0101947514/call",2: High-risk scam,scam,pesa loan available pesa user interest apply send,True,False,False
"SKM1LEND3L Confirmed. You have received Ksh4,530.00 From GRACE ATIENO on  22/11/24.New MPESA balance is  Ksh(LOCKED).Pay bills via mpesa.dial *33*000#",2: High-risk scam,scam,confirm receive grace atieno new mpesa balance ksh lock pay bill mpesa dial,True,False,False
"Nothing beats this,\nCongratulations, you've won 401 MILLI SportPesa Mega Jackpot!\n\nCheza na 99 bob, Kick-off ni LEO 8:30pm!\n\nhttps://spp.ke/MJPB\n\nStop *456*9*5#",2: High-risk scam,scam,beat congratulation win milli sportpesa mega jackpot cheza bob leo stop,True,False,False
"Do not be anxious about anything but in every situation by prayer and petition with thanksgiving,present your requests to God. Reply with  55 to let your callers see this message. To stop reply with stop.",0: Legit (Low-risk),legit,anxious situation prayer petition thanksgive present request god reply let caller message stop reply stop,True,False,False
Jingle all the way into the Holiday spirit  with a Christmas Tune.  with a Christmas Tune.  Dial *811# option 0 to subscribe!\n,0: Legit (Low-risk),legit,jingle way holiday spirit christmas tune christmas tune dial option subscribe,True,False,False
